"상처, 투쟁 그리고 개화",S000061838636,"억압과 폭력으로 신음하는 세상의 모든 이들에게총칼에 쓰러지지 않도록 희망과 용기를 선사하다일견 희곡의 형식을 띠고 있는 이 소설은 가상의 국가 ‘새터국’을 배경으로 한다. 이 나라의 집권 세력은 이웃 강대국에 의존하며 독재를 펴고 있다. “민주주의는 피를 먹고 자란다”라는 말처럼 새터국의 시민 세력도 유혈사태를 딛고 분연히 일어나 혁명을 향해 나아간다. 작가가 책을 통해 전하고자 하는 바는 명료하다. 우리가 권력에 굴복하지 않을 것을, 항상 두 눈을 시퍼렇게 뜨고 있을 것을 말한다. 앞으로 새터국의 운명은 어디로 향하게 될지, 이야기 속으로 들어가 그들과 연대해서 함께 나아가보도록 하자."
과학특성화중학교 2,S000061863233,"뜨인돌출판사 청소년 소설 시리즈 〈과학특성화중학교〉는 서울대학교 에너지시스템공학 박사이자 네이버 웹툰 〈닥터앤닥터 육아일기〉 작가 닥터베르가 청소년들에게 과학의 재미를 알려 주기 위해 집필한 과학 추리 판타지 소설이다. 이 시리즈는 총 3권으로, 화려하고 세밀한 배경 묘사와 귀엽고 훈훈한 캐릭터 디자인으로 청소년들에게 많은 사랑을 받는 리페 작가의 그림을 더해 세계관으로의 몰입을 한층 높였다. 2022년 상반기에 출간한 1권에 이어 이번에 출간하는 2권 ‘시간을 거슬러 온 조커와 사물함에 갇힌 우정’은 2학기 시작과 함께 학교의 두 번째 비밀을 파헤치는 올림피아드 준비부와 발레부의 대결을 흥미진진하게 그린다. 경쟁과 재미, 보상에 대한 욕심을 안고 각자의 속도로 조금씩 성장하는 아이들. 과연 두 번째 비밀을 풀고 승자의 불꽃을 쏘아 올릴 사람은 누가 될까?"
북녘 마을의 사람 사는 풍경,S000061897744,북한 단편서사에는 이데올로그가 강제하지 못하는 ‘너무나 인간적인’사람의 향기가 스며들어 있다. ‘주체형의 고상한 사람’이 아니라 좌충우돌 고민하고 내적으로 갈등하며 ‘고뇌하는 인간의 내면’이 텍스트의 행간에 잠복하고 있는 것이다. 이 편저는 단편 서사의 표면과 이면을 입체적으로 조망하면서 ‘어리석은 인간의 얼굴’로 자신과 세계를 이해하고 해석하려는 주인공들의 내면 풍경을 주목하였다. ‘신념의 화신’으로 등장하는 인물들보다 그 이데올로그적 존재의 곁에서 타인과 세계에 대해 의심을 품고 자신의 정체성을 탐색하는 ‘이방인적 존재’가 분석의 대상이 된 셈이다.
7인의 작가들 시소설집: 뜻밖의 의지,S000061898824,"라임(lime)처럼 상큼한 책과 콘텐츠를 만드는 출판사 리메로북스(limerobooks)의 두 번째 책 詩소설집 『뜻밖의 의지』가 출간되었다. 이장욱, 구병모, 김선재, 김수온, 여성민, 임현, 정지돈 등 개성 있는 작품세계를 구축해 온 작가들의 ‘시소설’ 7편을 엮었다. ‘시소설’은 단순히 시와 소설의 특징이 혼재된 것이 아니라, 시와 소설에 이미 내재해 있는 시적, 소설적 자질들을 어떻게 바라볼 것인가의 문제를 다룬다는 점에서 작가의 문학적 경험과 신념이 반영된 형식이라고 할 수 있다.  친구 “지혜”의 죽음이라는 서사에서 출발해 고유명사였던 “지혜”가 동음이의어인 일반명사로 쓰이다 형용사와 같이 존재하는 상황을 시적으로 풀어내는 이장욱의 『지혜와 거리두기』, 숨 쉬는 것조차 비용이 발생하는 현실을 “공기 요정”과 그것을 막는 “신제품”에 비유해 서술하는 구병모의 『숨값』, 실어증에 걸려 학대당하는 “너”를 베일에 싸인 “나”의 시점에서 묘사해 화자의 존재를 알레고리 속에 가두는 김선재의 『뜻밖의 의지』, “여인”이라는 등장인물들이 “정원”을 무대로 행동함으로써 상징주의극과 같은 해석의 여지를 남기는 김수온의 『애프터눈 티』, 언어의 반복, 대화의 맥락 없음 등 부조리극의 장치를 도입해 유희적으로 의미와 무의미를 오가는 여성민의 『밤에 해변에』, 누군가를 그리워하는 서사를 시적 상황으로 설정하고 섬세한 직유와 은유를 통해 문장을 이끌어나가는 임현의 『미망』, “프랑크 헨젤”을 추적하던 서사가 급작스럽게 다른 결말에 이르게 될 때 각 인물의 언어(행동)와 의미(해석) 사이의 균열을 포착해 내는 정지돈의 『프랑크 헨젤』 등 때로는 시편에 가깝게 때로는 서사 장르에 가깝게 창작된 다양한 작품들을 통해 독자는 시와 소설의 본래적 의미에 답하는 낯설고 흥미로운 화법을 감상하게 된다. 특히 구병모의 『숨값』은 코로나 유행 이전, 미세먼지 등으로 실외 활동 시 일부 소비되던 마스크에서 착상한 작품이다. 실제로 마스크 품귀 현상이 발생한 코로나 시기를 거쳐 지금은 실내 필수품이 된 현실을 염두에 둘 때, 문학이 시대의 무의식을 반영하는 동시에 배반하는 과정을 살필 수 있다. 단순한 형식의 차원을 넘어 산문에 잠재된 시적 아이러니를 발생시킨다는 점에서 의미를 부여할 수 있다."
아버지의 정인,S000061898189,"지난 1976년 중편소설 〈갱(坑)〉으로 제11회 세대신인문학상을 수상하고 문단에 등단한 후 소설집 〈갱(坑, 자료원 1996)〉, 장편소설 〈하늘 강냉이 1∼2권(자료원 2000)〉, 〈청해당의 아침(자료원, 2001)〉, 〈퇴함 1∼2권(메세나, 2003)〉, 〈장군의 여자 1∼2권(메세나 2010)〉 등을 발표해 온 소설가 서동익이 지난 34년간 문예지에 발표했던 중·단편 소설 8편을 간추려 두 번째 소설집을 펴냈다. 작가는 문단 등단 후 남북분단으로 인한 〈한국 현대소설문학의 반쪽 현상〉과 〈왜소성〉을 발견, 이를 극복하는 장편소설을 집필하다 북한 동포들의 일상적 라이프 스타일과 생활용어 속 정치용어, 경제용어, 은어 등에 막혀 실패한 후 직장을 대북전문기관인 자유의 소리방송, 통일부, 국방일보, 사)북방문제연구소 등에서 재직하며 전문적으로 북한을 연구하며 소설가 겸 북한전문가로 활동해왔다. 이번에 출간된 소설집에도 북한을 배경으로 하는 소설이 3편이나 수록돼 있을 정도로 그의 소설작품 속에는 언제나 남북한이 공존하며 한국 현대소설문학의 반쪽 현상을 극복하고자 하는 작가의 의지와 문학적 햇살이 빛나고 있다.이번에 출간된 작가의 소설집에는 지난 30년간 우리 국민(또는 북한주민)의 실존적 삶을 8편의 중·단편 소설로 압축한 작품집으로, 〈대청봉 가는 길〉은 IMF 외환 위기 당시 김영삼 정부가 국가 부도를 선언한 후 우리 국민과 출판계 종사자들이 당해야만 했던 비극적인 수난사를 조명한 소설로 독자들의 심금을 울린 작품이다.〈밤길〉은 IMF 돌풍이 남한 전역을 휩쓸고 갈 때 군사분계선 넘어 2000만 북한 주민들이 식량 배급제가 중단된 〈미공급 시기〉 식량을 구하려고 이승의 마지막 〈밤길〉을 헤매다 시체로 변해 공동묘지로 실려 간 평안도, 량강도, 자강도, 함경도 지역 주민 300만 명 아사 참사를 소설로 형상화한 작품이고, 〈아버지의 정인〉은 1970년 6월 5일 오후 1시경, 연평도 해상에서 NLL(북방한계선)을 몰래 넘어와 우리 어선을 보호 중이던 해군방송선을 향해 포격을 가해 승조원 20명 전원을 사상하게 한 후 그 시신과 방송선 선체를 북으로 끌고 간, 이른바 〈해군방송선 피랍 사건〉의 전모와 그 피랍자 유가족들이 남쪽에서 20여 년간 받아들여야만 했던 남북분단의 실제적 고통을 토로한 소설.〈그 마을〉은 해마다 50,000명 이상 태어나는 선천성이상아, 즉 옛날 어른들의 말로 ‘배냇병신’이 현대를 살아가고 있는 젊은 어머니의 뱃속에서부터 계속 태어나고 있는 실상을 추적한 소설로, 작가는 “이 선천성이상아의 출생을 신의 실수일까? 아니면 신을 능멸한 오만한 인간에 대한 경고일까?” 하고 현대를 살아가는 우리들에게 묻고 있다.이 외에도 현대인의 탐욕을 주제로 한 〈걸신〉, 전통적 가부장제 아래서 일찍이 가정을 일궈 가족을 부양해오던 가장이 탈선해 가정 내에서 폭력을 일삼는 〈아버지의 팔심〉, 이승에서 한평생을 다 살고 저승으로 떠나간 선조의 시신과 유골 문제를 사회적 시각에서 조명한 중편소설 〈그해 4월의 체험〉이 이 시대를 살아가는 독자들에게 감동을 안겨주고 있다."
짐승 같은 뉴비 9,S000061838472,"*뒷표지 글입니다.모든 게이트 공략법은 머릿속에 있다!절대자 뉴비(?)가 휘두르는 격노의 철권鐵拳!차원 역류에 휘말려 야수계로 떨어진 최원호야수계의 수왕獸王이 되어게이트 사태를 수습하고거신의 조각을 얻어 지구에 돌아오니……레벨이 다시 1?무리한 마나 운용으로 폐인이 된 동생의식불명, 행방불명에 사망까지 한 친구들신인류라 주장하는 테러리스트의 위협까지……모든 걸 돌려놓아야 한다, 게이트 사태 이전으로!야수계의 구원자, 최원호업적을 복구해 지구를 구하라!"
미칠 듯이 사랑했다 세트(전3권),S000061896749,"아스라이 멀어져간 70년대 숨겨졌던 첫사랑의 향수!파도에 실려 오는 듯한 고결한 사랑과 믿음, 이해와 포용의 가치가 존재하는 아름다운 영혼은 첫사랑이다.첫사랑을 잉태했던 그 바닷가를 찾아 눈물 짖는 여인!행복한 가정을 지키기 위해 남편의 과거를 가슴에 품은 여인!두 여인의 운명적인 동행이 펼치는 눈꽃 같은 특별한 가족!"
깊은숨,S000061776832,“그들은 회피하지 않는다. 도망치지 않는다.정직하게 온몸으로 환멸의 순간을 겪어낸다.고독하고 의연한 수련자처럼. 그들이 수련하는 것은 삶 그 자체다.”_정이현(소설가)
존은 제인을 만났지만,S000061896304,"제7회 불꽃문학상과 제6회 이호철통일로문학상 특별상을 수상한 장마리 소설가가 두 번째 단편집이자 다섯 번째 작품집인 『존은 제인을 만났지만』을 《실천문학사》에서 펴냈다.  가족 간의 관계, 순혈주의로 인한 배타성, 성과를 내기 위해 개인이 감내해야 했을 심리적 압박 내지 고독함, 그리고 세대 갈등에 따른 문제 등, 삶을 역설적으로 작동시킨 다양한 전복적 상상력이 가동된 8편의 단편들로 엮은 중견 작가의 작품집이다.   천일염 염부와 그 아들의 지난한 삶을 그린 「송화.COM」이나 할아버지 나라에 뿌리 찾기와 동시에 돈을 벌려고 온 러시아 망명 독립운동가 손자의 참담한 현실을 그린 「빅토르 최」같이 전형적인 리얼리즘 작품부터 미래형 고려장을 상상해서 그려낸 「2040, 무릉 시티」나 아직 대중화되지 않은 스포츠인 ‘파쿠르’를 매개로 미래의 가족상의 한 형태를 보여주는 「아빠가 누구냐고 묻지 마세요」 등의 작품들은 작가가 시종일관 애정을 가지고 천착하고 있는 이 자본주의 사회에서 결핍되고 소외된 인간 군상들(노인, 결손 가정, 외국인 노동자 등)에 대한 서사로 독자들에게 신선하게 다가가리라 본다."
그 시간이 되면 그는 외롭다,S000061898432,"심리상담을 하다보면 다양한 사람들을 만납니다. 인간 관계에서 큰 상처를 받은 이도, 나도 나를 잘 모르겠다며 오는 이도, 자기자신을 경멸하고 미워하는 이도 보죠. 그들은 이해 되지 않는 사람들과 얽히며 살아갑니다. 당연히 걸려 넘어지기를 반복합니다.저는 그럴 때 “소설을 써보는 건 어때요?” 라고 권유합니다. 쓰기 어렵다면 다양한 책을 읽어보아도 괜찮습니다. 더 솔직히 말해볼까요? 전문가가 되어 심리상담을 업으로 삼을 생각이 없다면, 대중심리서나 자기계발서를 볼 시간에 소설 한 권을 읽는 편이 더 낫다고 생각합니다.  왜냐고요? 소설이야말로 사람이 있고 삶이 있으니까요.초등학교 시절부터 제 취미는 만화 그리기였습니다. 그림 실력이 뛰어난 편은 아니었습니다만 딱히 중요하지 않았습니다. 제가 좋아하는 건 그림으로 나타내는 ‘이야기의 신선함’ 이었거든요. 그림은 이를 위한 ‘수단’ 일 뿐이었습니다. 남들이 생각 못 한 이야기, 기가 막힌 반전을 쓰고 싶어 했습니다. 스토리에 집중했습니다. 등장인물이 나왔지만 전개를 위해 소비되는 존재 그 이상도 이하도 아니었습니다. 하지만 만화를 그리면 그릴수록 생각이 바뀌었습니다. 처음엔 신선한 이야기를 위해 쓰여졌던 인물이 서사를 거듭하며 나름의 과거와 고유한 성격을 갖기 시작했습니다. 그럴수록 인물은 입체성 즉, 생명력을 가지기 시작했습니다. 심지어 어떠한 상황이 주어지면 스토리를 만들지 않아도 인물들이 살아 움직이며 적절한 전개를 알아서 찾아나갔습니다. 더 이상 인물을 스토리에 끼워 맞출 수 없게 되었습니다.‘이 캐릭터라면 지금과 같은 상황에 어떤 선택을 할까?’ 묻고 답하는 과정에서 전혀 생각지 못 했던 전개로 흘러가기도 했습니다. 스토리는 그게 아니었습니다만 어쩌겠어요. 이미 인물이 생명력을 가지고 자기가 알아서 움직이고 있는데요. 믿고 맡겨야지요. 결과는 어땠냐고요? 초반보다 훨씬 재밌고 박진감 넘치는 전개가 되었습니다. 그제서야 알게 되었습니다. 핵심은 스토리가 아니었습니다. 인물이 얼마나 개연성 있게 움직이는가? 였죠. 우리들의 삶 또한 마찬가지 아닐까요? 우린 태어나는 순간부터 (어쩌면 그 전부터 이미)수많은 맥락을 쌓으며 고유한 생명력을 지닙니다. 헌데 그 생명력을 이해할 틈도 없이 정해진 틀에, 스토리에 자신을 맞춰야 한다는 압박을 받아요. 압박의 힘이 매우 거세다면 자신의 팔, 다리, 영혼을 깎아서라도 끼웁니다. 이 상황에서 누구도 상황을 개연성 있게 움직이지 못 합니다. 죽은 채로 부품의 삶을 살게 되지요.이 단편집은 제가 저의 생명력을 이해하기 위해 했던 수년간의 기록입니다. 차마 누군가에게 털어 놓을 수 없는 감정을, 생각을, 행동을 가상의 인물에 담은 일기입니다. 어떠한 상황 속에 넣어놓고 일기 속 인물은 어떻게 하는 지 살펴본 실험 기록입니다. 그래서 이 책을 보다보면 생각보다 우울하고, 그로테스크하고, 이상하고, 거북할 지도 모릅니다. 근데 누구에게나 있어요. 저에게도, 당신에게도, 누구에게도. 그러니 59개로 이루어진 저의 일기 뒤에 마지막 당신의 공간도 마련해두었습니다.이 책은 그 공간에 누구도 알 수 없는 당신의 생명력을 적음으로써 마무리됩니다. 즐겁게 살펴보시고, 진지하게 사색하면서 마지막 공간까지 즐겁게 매듭? 음, 시작하시길 바랍니다.그럼 함께 시작할까요? 어떻게 형아쌤은 생명력을 가지게 되었는지. 그 기록을."
회귀한 도끼천재가 살아가는 법 8,S000061863437,"「위대한 가문의 대마법사」의 작가 최달해그가 선사하는 통쾌한 신작!「회귀한 도끼천재가 살아가는 법」‘도살자’라 불리며 대륙 모든 이들이두려워하는 존재, 데인 크라젤그는 억울한 누명을 쓰고 죽음을 맞이하는데……“이번에야말로 내 손으로 죽일 수 있겠구만.”하고 싶으면 한다!누구도 막을 수 없는미친 도살자가 돌아왔다!"
나는 인간입니다,S000061863907,"괴물로 변해 버린 ‘그들’로부터 가족을 보호하기 위해 스스로 ‘그들’과 같은 괴물이기를 선택한 남자.당신은 그를 괴물이라 부를 것인가, 인간이라 부를 것인가?가족의 가치를 지키기 위해 가족을 외면해야 했던, 한 가장의 존재를 건 사투!"
원 그리기,S000061776322,"이공계 출신으로, 내가 읽고 싶은 소설을 쓰겠다며 장편소설을 쓰다가 2017년 부산일보 신춘문예 단편소설 「문어」로 등단한 신호철의 첫 소설집 『원 그리기』가 출간되었다. 물리학을 전공했지만 뒤늦게 양자역학에 관해 관심을 가졌고, 그 속에서 문학적 가능성이 있다고 생각한 작가는 점차 다양해지고 있는 문학 장르에서, 과학이라는 필터가 살짝 가미된 이 소설이 독자에게 새로운 느낌으로 받아들여질 수 있기를 희망했다. 소설집 『원 그리기』에 수록된 9편의 단편들은 인간 본연의 모습을 말하며, 욕망, 타인의 시선, 자아, 중독, 타락, 아름다움, 죽음 등의 소재로 삶에 관해 이야기하고, 과연 인간다움이 무엇인지를 자문하고 있다. 그것은 현실을 바라보는 작가 나름의 시선과 자의식이 투영된 결과가 아닐까 싶다. 신호철의 소설이 주목하는 것은 오늘날 우리들의 삶이 드러내는 갖가지 병리적인 실태들이다. 생존을 어렵게 만드는 세계에서 살아남기 위해 몸부림치는 사람들의 이야기, 작가는 그 환자들이 내지르는 비명과 신음에 주의 깊게 귀를 기울이고 있는 것이다. 그리고 그는 그 고통의 소리들을 전하면서, 공감함으로써 가능한 어떤 공명共鳴의 순간을 기다리고 있는 것처럼 보인다."
하북팽가 검술천재 7,S000061838473,"*뒷표지 글입니다.정마 대전의 영웅, 무無부터 다시 시작하다!목숨 바쳐 싸웠음에도가차 없이 ‘팽’ 당했던 광귀, 팽한빈.현세와 작별까지 고했는데…… 어라?눈 떠 보니 20년 전?심지어 ‘하북 최고의 겁쟁이’ 시절로 회귀했다?[용안龍眼으로 구결을 확인하시겠습니까?]흩어진 구결을 다 모아 비급을 완성한다면하북 최강이 되는 것도 시간문제!겁쟁이보단 망나니가 낫겠지!팽가의 수치가 도, 아니 검술천재로 돌아왔다!"
공상연애소설,S000061838612,"dcdc라는 작가가 있었다. 그는 유쾌하게 빈정거리기를 좋아하고, 쉽게 눈길이 가지 않는 것에 애정을 느꼈으며, 성격 나쁜 오타쿠였다. 그의 글은 반짝이는 날붙이 같았다. 칼날에 오래된 미국 애니메이션 캐릭터 스티커가 붙어 있고, 휘둘러봤자 생채기 내는 게 전부인 작은 날붙이. 하지만 그는 어느 순간 날붙이만이 가질 수 있는 스타일리시한 빈정거림을 내려놓았다. dcdc가 사라진 것이다.첫째, 첫 번째 단편집 《대통령 항문에 사보타지》에서 보이던 꽤 노골적인 섹스에 대한 은유가 두 번째 단편집 《구미베어 살인사건》에서부터 사라졌다. 둘째, 스타일리시하게 문장으로 후려 패던 대상도 점차 사라졌다. 셋째, ‘팬심’이 사라졌다. 그는 자기 자신보다 자신이 사랑하는 것들에 대해 이야기할 때 더 빛났다. 도대체 dcdc는 왜 사라졌는가? 이 세 가지 징후를 종합하자면 하나다. 이 작가는 나이를 먹고 말았다. 작가로서 가장 큰 매력이었던 날붙이를 더 이상 쓸 수 없다는 결론을 내린 것이다. 대신 그는 이전보다 조심스러워졌고 사랑할 다른 대상을 찾았다. 그렇다면 이제 나이를 먹은 dcdc는 무엇이 될까.이 질문의 답이 바로 이 단편집 《공상연애소설》이다."
여기는 Q대학교 입학처입니다,S000061777048,"제2회 〈넥서스 경장편 작가상〉 우수상을 수상한 권제훈 작가의 《여기는 Q대학교 입학처입니다》가 드디어 출간되었다. 《여기는 Q대학교 입학처입니다》는 가상의 장소 ‘Q대학교 입학처’에서 우후죽순 벌어지는 소소한 사건들을 통해 삶의 애환을 그려나간 리얼리티 소설이다. ‘입학처’라는 신선한 소재에서 읽는 이의 눈을 사로잡고, 각기 다른 사연을 가지고 있는 등장인물들의 이야기에 또 한 번 마음이 동한다. 입학처 이야기에 머무르지 않고 삶이라는 큰 틀 안에서 사람들이 알게 모르게 경쟁하며 살아가는 그 치열함을 소설에 잘 녹여내면서 “제도적 갈등을 통해 한 사회의 축도(縮圖)를 제시해 주었다”라는 심사평을 받은 만큼 이 소설은 독자들의 공감을 충분히 이끌어낼 것이다."
모던 하트,S000061776843,"“연애라는 강물이 흘러가면서 주변에 있는 회사, 가정, 사회 등의 디테일을 하나하나 정밀하고 사실적으로 살려낸다. 그 결과 우리 사회의 문제적 단면이라고 할 풍경 하나가 완성되었다.” _은희경(소설가)1996년 제정된 한겨레문학상은 심윤경의 《나의 아름다운 정원》, 박민규의 《삼미 슈퍼스타즈의 마지막 팬클럽》, 윤고은의 《무중력 증후군》, 최진영의 《당신 옆을 스쳐간 그 소녀의 이름은》, 장강명의 《표백》, 강화길의 《다른 사람》, 박서련의 《체공녀 강주룡》, 서수진의 《코리안 티처》, 김유원의 《불펜의 시간》, 강성봉의 《카지노 베이비》 등 한국문학의 새로운 지형도를 그린 작품들을 선보이며 오랜 시간 독자들의 꾸준한 사랑을 받았다. 정아은의 《모던 하트》는 2013년 당시 “가벼움과 무거움의 경계, 통속과 품위의 경계, 훈계와 반성의 경계에서 즐거이 줄타기하는 세태소설의 모범 답안” “눈으로 읽고 있지만 귀로 들리는 소설”이라는 평을 받으며, 252편의 경쟁작 가운데 본심 심사위원들의 만장일치로 당선되었다. 무엇보다 우리 주변의 평범한 샐러리맨의 세태를 안정된 문장력으로 생생하게 반영하고 있다는 점에서 높은 평가를 받았다.《모던 하트》는 헤드헌터로 일하고 있는 서른일곱 살 김미연의 삶을 통해 대도시 안에서 살아가는 이 시대 연인과 직장의 풍속도를 생생하게 그려낸다. 미연은 학벌이라는 낙인으로부터 자유로울 수 없는 철저한 계급사회에서 발버둥을 치며 살아간다. 출신 대학에 따라 사람에게 등급을 매기는 묵시적 차별이 회사 조직은 물론, 연애와 결혼 같은 개인의 삶과 내면까지 확고하게 지배하는 현실을 《모던 하트》는 솔직하고 세세하게 묘사한다. 또한 주인공을 둘러싼 가족, 친구들의 이야기를 통해 슈퍼맘의 고충과 그를 둘러싼 관습과 제도의 문제, 세대 간의 갈등 등을 폭넓게 보여준다. 특히 일, 연애, 결혼이 드라마처럼 해피엔딩으로만 끝날 수 없는 비루한 일상을 탁월하게 묘사하며, 속도감 있게 독자들을 이야기 속으로 끌고 들어간다."
"감염인간, 낸즈",S000061776191,"〈YA!〉 시리즈의 일곱 번째 책으로 문상온 작가의 『감염인간, 낸즈』가 출간되었다. 『감염인간, 낸즈』는 바이러스에 감염된 후 회복한 사람들과 그들을 억압하는 계엄 정부 그리고 사태를 해결할 실마리를 지닌 한 소년에 관한 이야기다. 바이러스와 감염을 이용하는 상류층의 횡포를 소년의 시선에서 바라보며 기존의 아포칼립스 서사에서 볼 수 없던 새로운 느낌을 자아낸다. 더불어 속도감 있는 액션과 빠져들 수밖에 없는 매력적인 캐릭터들이 이야기에 힘을 더하며 한 편의 영화를 본 듯한 기분이 들 것이다.『감염인간, 낸즈』는 특이하게도 ‘낸즈’라 불리는 좀비의 비중이 지배적이지 않다. 낸즈를 자주 등장시키기보다는 낸즈 사태 이후 새로운 세계관 속에서 인물들이 겪게 되는 사건과 갈등에 집중한다. 작품의 분위기가 무겁고 처지기보다는 긴박하고 투지 넘치는 이유도 이 때문일 것이다. 여기에 엔데믹에 접어드는 현 상황과 맞물려 이 책을 읽는 독자에게 뛰어난 몰입감을 선사한다. 작품만의 독특한 세계관과 이야기를 따라가다 보면 어느새 인물이 처한 상황에 공감하는 자신을 발견하게 될 것이다."
